{
 "schemaVersion": 1,
 "sut": "hotel",
 "extraction": {
  "procedure": "research/ontology/EXTRACTION_PROTOCOL.md",
  "extractor": "B",
  "model": "haiku (Haiku 5.5)",
  "system": "hotel",
  "service": "geo",
  "unconverted": [
   {
    "item": "registry heartbeat / failure timeout / cleanup interval",
    "note": "library default, not in these files: registration has no Check field (upstream/deathstarbench/hotelReservation/registry/registry.go:85-90, AgentServiceRegistration with ID, Name, Port, Address only); Register is called once in Run before srv.Serve (services/geo/server.go:81, 87); no heartbeat loop in these files"
   },
   {
    "item": "deregistration",
    "note": "Shutdown() calls s.Registry.Deregister(s.uuid) (services/geo/server.go:91-92) but cmd/geo/main.go (lines 19-73) never calls Shutdown"
   },
   {
    "item": "health check",
    "file": "upstream/deathstarbench/hotelReservation/docker-compose.yml",
    "line": 81,
    "token": "geo:",
    "note": "library default, not in these files: no healthcheck key in the geo block (docker-compose.yml:81-100) nor in modules/hotel-reservation/deployment/compose.observability-placement.yml:17-21"
   },
   {
    "item": "traces: sampling ratio",
    "file": "upstream/deathstarbench/hotelReservation/tracing/tracer.go",
    "line": 14,
    "token": "defaultSampleRatio float64 = 0.01",
    "note": "overridden by JAEGER_SAMPLE_RATIO (tracer.go:20); the observability compose sets JAEGER_SAMPLE_RATIO: ${HR_JAEGER_SAMPLE_RATIO:-1} (modules/hotel-reservation/deployment/compose.observability-placement.yml:20), so the default ratio in this deployment is 1"
   },
   {
    "item": "traces: span flush interval",
    "file": "upstream/deathstarbench/hotelReservation/tracing/tracer.go",
    "line": 36,
    "token": "BufferFlushInterval: 1 * time.Second",
    "note": "reporter buffer flush interval 1 s"
   },
   {
    "item": "traces: JAEGER_DISABLED",
    "file": "modules/hotel-reservation/deployment/compose.observability-placement.yml",
    "line": 21,
    "token": "JAEGER_DISABLED: ${HR_JAEGER_DISABLED:-false}",
    "note": "read by the library config FromEnv (upstream/deathstarbench/hotelReservation/tracing/tracer.go:42); library default, not in these files, for how the variable is interpreted"
   },
   {
    "item": "metrics",
    "note": "no metrics emitter in these files (no metrics import or collector in cmd/geo, services/geo, tracing, tune)"
   },
   {
    "item": "logs: level",
    "file": "upstream/deathstarbench/hotelReservation/tune/setting.go",
    "line": 19,
    "token": "defaultLogLevel string = \"info\"",
    "note": "LOG_LEVEL is passed through in upstream docker-compose.yml:25 with no value set; the observability compose sets no LOG_LEVEL for geo (lines 17-21)"
   }
  ]
 },
 "sources": {
  "upstream": {
   "path": "../observability-placement-runtime-hotel-protocol/upstream/deathstarbench",
   "commit": "6ecb09706140f8730b5385c08f1386c654c3c526"
  },
  "harness": {
   "path": "../observability-placement-runtime-hotel-protocol",
   "commit": "e9d35f7fffcab4134b53a864cd36613cc628cb4d"
  }
 },
 "services": [
  {
   "name": {
    "value": "geo",
    "basis": "cited",
    "repo": "upstream",
    "sourceFile": "hotelReservation/docker-compose.yml",
    "line": 81,
    "quotedToken": "geo:"
   },
   "container": {
    "value": "geo",
    "basis": "cited",
    "repo": "upstream",
    "sourceFile": "hotelReservation/docker-compose.yml",
    "line": 81,
    "quotedToken": "geo:",
    "note": "no container_name in block lines 81-100; container name is the compose service key, library default, not in these files"
   },
   "replicas": {
    "value": 1,
    "basis": "cited",
    "repo": "upstream",
    "sourceFile": "hotelReservation/docker-compose.yml",
    "line": 98,
    "quotedToken": "replicas: 1",
    "note": "the observability compose (compose.observability-placement.yml:17-21) sets no replicas key for geo"
   },
   "exportsTelemetryTo": [
    {
     "value": "jaeger",
     "basis": "cited",
     "repo": "upstream",
     "sourceFile": "hotelReservation/config.json",
     "line": 3,
     "quotedToken": "\"jaegerAddress\": \"jaeger:6831\"",
     "note": "traces: Jaeger agent address read as flag default (cmd/geo/main.go:44) and passed to tracing.Init (main.go:50)"
    }
   ],
   "registersWith": [
    {
     "value": "consul",
     "basis": "cited",
     "repo": "upstream",
     "sourceFile": "hotelReservation/services/geo/server.go",
     "line": 81,
     "quotedToken": "s.Registry.Register(name, s.uuid, s.IpAddr, s.Port)",
     "note": "registered as srv-geo (server.go:24, name constant); consul address config.json:2 \"consulAddress\": \"consul:8500\"; registration sent through registry.go:92 ServiceRegister"
    }
   ],
   "emits": [
    {
     "kind": "span",
     "id": {
      "value": "otgrpc server interceptor (gRPC server spans)",
      "basis": "cited",
      "repo": "upstream",
      "sourceFile": "hotelReservation/services/geo/server.go",
      "line": 63,
      "quotedToken": "otgrpc.OpenTracingServerInterceptor(s.Tracer)"
     }
    },
    {
     "kind": "log",
     "id": {
      "value": "zerolog console writer to stdout",
      "basis": "cited",
      "repo": "upstream",
      "sourceFile": "hotelReservation/cmd/geo/main.go",
      "line": 21,
      "quotedToken": "zerolog.ConsoleWriter{Out: os.Stdout"
     }
    }
   ]
  }
 ],
 "coordinators": [
  {
   "name": {
    "value": "consul",
    "basis": "cited",
    "repo": "upstream",
    "sourceFile": "hotelReservation/docker-compose.yml",
    "line": 4,
    "quotedToken": "consul:"
   },
   "type": {
    "value": "ServiceRegistry",
    "basis": "cited",
    "repo": "upstream",
    "sourceFile": "hotelReservation/registry/registry.go",
    "line": 25,
    "quotedToken": "communicating with registry",
    "note": "Client wraps the consul API client (registry.go:26-28); the Consul image is in docker-compose.yml:5"
   },
   "hostedBy": {
    "value": "consul",
    "basis": "cited",
    "repo": "upstream",
    "sourceFile": "hotelReservation/docker-compose.yml",
    "line": 4,
    "quotedToken": "consul:",
    "note": "the compose service consul runs hashicorp/consul:latest (docker-compose.yml:5)"
   }
  }
 ]
}
